Impact ID,Title,Post Date,Start Date,End Date,Description,Categories,Places,
53712,Updated water allocation of 5% for California's State Water Project,03/23/2021,12/01/2020,12/31/2021,"The California Department of Water Resources updated its initial water allocation for the 2021 water year to 5% of requested supplies, down from 10% as announced in December 2020.  The allocation will be finalized by May.  The State Water Project serves more than 27 million people and provides irrigation for about 750,000 acres of farmland, mostly in the San Joaquin Valley.YubaNet (Calif.), March 23, 2021The California Department of Water Resources announced the initial water allocation of 10 percent for the State Water Project.  While the initial allocation was low, the allocation last year was also 10 percent, but was increased to 20 percent in May 2020. Napa Valley Register (Calif.), Dec. 1 2020","Agriculture, Relief, Response & Restrictions, Water Supply & Quality","Alameda County, CA, Butte County, CA, Fresno County, CA, Kern County, CA, Kings County, CA, Los Angeles County, CA, Napa County, CA, Orange County, CA, Plumas County, CA, Riverside County, CA, San Bernardino County, CA, San Diego County, CA, San Luis Obispo County, CA, Santa Barbara County, CA, Santa Clara County, CA, Solano County, CA, Yuba City, CA, Tulare County, CA, Ventura County, CA",
51648,"Phase II water emergency in St. Helena, California",03/24/2021,10/27/2020,03/24/2021,"New penalties will be imposed on St. Helena water customers who exceed their rations beginning May 1 as the Phase II water emergency continued.  The penalties must be approved at an upcoming April 13 council meeting. The city allocates 65 gallons per person daily, plus 2,500 gallons per month for outdoor use.  St. Helena’s Bell Canyon Reservoir is at 42% of capacity.Napa Valley Register (Calif.), March 24, 2021The Phase II water emergency remained in effect for St. Helena.  Bell Canyon Reservoir had an elevation of 400.11 feet, or about 40% of capacity.  Napa Valley Register (Calif.), March 10, 2021Drought and increased water demand for firefighting led St. Helena authorities to declare a Phase II water emergency and order mandatory rationing.  Bell Canyon Reservoir was at 38.8 percent of capacity after a year of meager rainfall yielding just 20 inches.  An unknown amount of water was also used to fight the LNU Lightning Complex and Glass fires.Napa Valley Register (Calif.), Oct 28, 2020","Relief, Response & Restrictions, Water Supply & Quality","Napa County, CA, Saint Helena, CA",
51415,"Drought, heat affected grape growth in Napa County, California",09/02/2020,08/25/2020, ,"A grape grower in Carneros reported vines struggling, due to dry soils, and reduced yields.  Chardonnay yields were down over 50 percent and Pinot Noir grapes were at least 15 percent below average.  Napa Valley Register (Calif.), Aug. 25, 2020",Agriculture,"Napa County, CA, Carneros (historical), CA",
51248,"Water shortage emergency in Inverness, California",07/30/2020,07/22/2020, ,"A water shortage emergency was declared in Inverness as dry weather depleted water supplies.  Point Reyes Light (Point Reyes Station, Calif.), July 29, 2020The Inverness Public Utility planned to declare a water shortage emergency on July 22, due to historic low rainfall in the watershed.  The district has no reservoirs and instead draws from stream flows from the Inverness Ridge to refill its storage tanks.  Although the area typically receives 15.5 inches of precipitation from February through June, only 6 inches fell.  Marin Independent Journal (Calif.), July 16, 2020","Relief, Response & Restrictions, Water Supply & Quality","Inverness, CA",
51249,"Water conservation alert in Bolinas, California",07/30/2020,07/19/2020, ,"The Bolinas Community Public Utility District issued a conservation alert on June 19 requesting a 20 to 30 percent reduction in water use.  The district has a moratorium on new connections to its system, due to a limited supply from Arroyo Hondo Creek and two emergency reservoirs.  Water rationing could be enacted as early as this summer.Marin Independent Journal (Calif.), July 16, 2020","Relief, Response & Restrictions, Water Supply & Quality","Bolinas, CA",
53997,"Drought reduced number of potholes in Los Angeles, California",04/20/2021,07/01/2020,03/31/2021,"Pothole service requests in Los Angeles were down 25%, per the Los Angeles Bureau of Street Services.  Just 14,000 potholes were reported in the first nine months of the fiscal year, compared to 18,400 the previous period.  The decrease is partly due to drought as there was less water to damage roads.Spectrum News 1 (El Segundo, Calif.), April 19, 2021",Society & Public Health,"Los Angeles, CA",
51161,"Stage 4 drought for Mendocino,California",07/29/2020,06/29/2020,07/27/2020,"The stage 4 drought declared for Mendocino on June 29 continued with no change in conditions that prompted the current declaration.The Mendocino Beacon (Calif.), July 28, 2020The Mendocino City Community Services District Board declared a Stage 4 drought, cutting water allotments by 40 percent, as current rainfall was 50 percent of normal for the water year. No new groundwater extraction permits will be considered.  The Mendocino Beacon (Calif.), July 7, 2020","Relief, Response & Restrictions, Water Supply & Quality","Mendocino, CA",
51127,"Phase I water emergency in St. Helena, California",11/03/2020,06/23/2020,10/26/2020,"The St. Helena City Council declared a Phase I water emergency on June 23.  Since July 2019, the city received just 20 inches of rain, leaving Bell Canyon Reservoir at 60 percent of capacity and expected to fall to 33 to 40 percent in November.  The reservoir is one of three water sources for St. Helena. Napa Valley Register (Calif.), June 27, 2020","Relief, Response & Restrictions, Water Supply & Quality","Saint Helena, CA",
51250,Water conservation mandate for North Marin Water District in California,03/03/2021,04/27/2020,02/27/2021,"The North Marin Water District, serving Novato, implemented a 25 percent water conservation mandate on July 1, due to the water shortage emergency declared in early May when customers were asked to voluntarily reduce water use by 15 percent in May and June.  Marin Independent Journal (Calif.), July 16, 2020","Relief, Response & Restrictions, Water Supply & Quality","Novato, CA",
50810,State Water Project allocation estimate of 20 percent for California water agencies,05/28/2020,12/30/2019,05/26/2020,"After a dry winter, the State Water Project increased its allocation to 20 percent following above normal precipitation in May.  The initial allocation in December 2019 was 10 percent, and the January estimate was increased to 15 percent.  The most recent allocation will likely be final for 2020.East County Today (Antioch, Calif.), May 26, 2020The State Water Project allocation for 2020 remained at 15 percent as of May 13.Ag Alert (Sacramento, Calif.), May 13, 2020The California Department of Water Resource estimated a delivery allocation of 15 percent for the San Bernardino Valley Municipal Water District and other agencies which receive water from the State Water Project.  The SWP typically provides closer to 30 percent of the needed water, but snowpack in the Sierra Nevada was 70 percent of normal at the end of January.Highland Community News (Calif.), Feb. 13, 2020","Relief, Response & Restrictions, Water Supply & Quality","Alameda County, CA, Butte County, CA, Fresno County, CA, Kern County, CA, Kings County, CA, Los Angeles County, CA, Napa County, CA, Orange County, CA, Plumas County, CA, Riverside County, CA, San Bernardino County, CA, San Diego County, CA, San Luis Obispo County, CA, Santa Barbara County, CA, Santa Clara County, CA, Solano County, CA, Yuba City, CA, Tulare County, CA, Ventura County, CA",
48668,"Trees, shrubs being replanted after drought in Bakersfield, California",10/25/2019,10/24/2019, ,"Drought in recent years killed many trees and shrubs throughout Bakersfield.  The city was aiming to plant 3,550 trees and 32,100 shrubs to replace the dead ones at a cost of $1.5 million.  Bakersfield.com (Calif.), Oct. 24, 2019","Plants & Wildlife, Society & Public Health","Bakersfield, CA",
48004,Initial allocation of 10 percent for California's State Water Project,12/04/2018,11/30/2018, ,"The California Department of Water Resources announced the initial water allocation of 10 percent for the State Water Project contractors for the 2019 calendar year, due to a dry start to the 2019 water year.  In addition, many large reservoirs were below average.  Department of Water Resources (Sacramento, Calif.), Nov. 30, 2018","Relief, Response & Restrictions, Water Supply & Quality","Alameda County, CA, Butte County, CA, Fresno County, CA, Kern County, CA, Kings County, CA, Los Angeles County, CA, Napa County, CA, Orange County, CA, Plumas County, CA, Riverside County, CA, San Bernardino County, CA, San Diego County, CA, San Luis Obispo County, CA, Santa Barbara County, CA, Santa Clara County, CA, Solano County, CA, Yuba City, CA, Tulare County, CA, Ventura County, CA",
47972,"Woolsey, Hill fires in southern California",11/13/2018,11/08/2018, ,"The Woolsey fire burned 151 square miles, consumed more than 430 homes, businesses and other buildings and took two lives.  The blaze was 40 percent contained.  Des Moines Register (Iowa), Nov. 13, 2018Continuing drought in California, ample vegetation and strong winds have set the stage for immense wildfires in southern California, where the Woolsey and Hill fires forced the evacuation of several communities in Los Angeles and Ventura counties, including Malibu and Calabasas.  The Woolsey fire blackened 85,500 acres, killed two people, destroyed 177 homes and was 10 percent contained.  The Hill fire was 70 percent contained. ABC News Radio (New York), Nov. 12, 2018",Fire,"Los Angeles County, CA, Calabasas, CA, Malibu, CA, Ventura County, CA",
45480,The Carr Fire in Northern California,08/21/2018,07/23/2018,08/20/2018,"The Carr fire devastated 229,651 acres, took eight lives and consumed more than 1,000 homes.  The blaze was 88 percent contained as of Aug. 20.Los Angeles Times (Calif.), Aug. 20, 2018The Carr fire west of Redding consumed more than 110,000 acres and at least 818 homes as firefighters continued to battle the flames, which were 27 percent contained. The blaze was the largest and most destructive of 17 fires burning in the state as the fire season looked to be one of the earliest and worst fire seasons for the Golden State.Los Angeles Times (Calif.), Aug. 1, 2018The Carr Fire had burned 80,906 acres through July 28, consumed 500 buildings and taken the lives of five people as extreme heat, low humidity and unpredictable winds fed the flames. Washington Post (D.C.), July 28, 2018The Carr fire was driven by extreme heat and an abundance of dried fuels and burned intensely enough to create its own weather, said fire experts.  After five years of drought, followed by record heavy rains in Northern California in 2017, there was ample fuel to burn. Los Angeles Times (Calif.), July 28, 2018",Fire,"Shasta County, CA, Redding, CA, Trinity County, CA",
46792,"Parks, medians receive extra watering in Long Beach, California",08/31/2018,07/01/2018,06/30/2019,"The City of Long Beach approved an additional $900,000 for watering parks and medians to make them look nicer after drought parched vegetation.  Rainfall at the airport during the 2017-18 season, ending in June, was 3.65 inches, more than 7 inches below normal. Long Beach Post (Calif.), Aug. 29, 2018","Plants & Wildlife, Society & Public Health, Water Supply & Quality","Long Beach, CA",
45087,"U.S. Bureau of Reclamation awarded $8.3 million to California, New Mexico and Utah",06/27/2018,06/26/2018, ,"The U.S. Bureau of Reclamation awarded $8.3 million for 15 projects in California, New Mexico and Utah for preparation and response to drought.  The types of projects chosen will increase water management flexibility and water supply reliability, while also lowering the need for emergency response actions to drought.seattlepi.com (Wash.), June 26, 2018","Relief, Response & Restrictions, Water Supply & Quality","California, Sacramento County, CA, Sacramento, CA, New Mexico, Sierra County, NM, Utah, Sanpete County, UT, Ephraim, UT",
48672,"Seven to eight million dead trees in Kern County, California",10/25/2019,03/13/2018, ,"Kern County officials were planning to remove thousands of dead wildland pine trees that were killed by drought and an infestation of bark beetles.  The county was awarded nearly $2.2 million in state grant funds to remove trees near roadways and public facilities to protect the public from falling trees and wildfires.  The Kern County Fire Chief estimated that there were seven to eight million dead trees in the county.Bakersfield.com (Calf.), March 13, 2018","Plants & Wildlife, Relief, Response & Restrictions","Kern County, CA, Piute (historical), CA, Tehachapi, CA",
44265,"Yountville, California warned about low water supply",02/23/2018,02/19/2018, ,"The reservoir supplying Yountville was running low, prompting the State Water Resources Control Board to warn the town and the reservoir owner that they may face low water supplies come summer. Napa Valley Register (Calif.), Feb. 19, 2018","Relief, Response & Restrictions, Water Supply & Quality","Yountville, CA",
44179,Slim poppy crop at Antelope Valley California Poppy Reserve,02/13/2018,02/13/2018, ,"Only a few poppies came up at the Antelope Valley California Poppy Reserve in Lancaster, which does not bode well for the springtime wildflower bloom.  The nearby hills were mostly brown.  Los Angeles Times (Calif.), Feb. 13, 2018",Plants & Wildlife,"Los Angeles County, CA, Lancaster, CA",
48676,"Hundreds of thousands of trees lost in Bear Valley Springs, California",10/30/2019,02/12/2018, ,"Nearly 1,000 tree seedlings were given out by firefighters from Kern County’s Station 16 in Bear Valley Springs to begin to replace the hundreds of thousands of trees lost in recent years to drought and bark beetles.  ""In some places, 100 percent of the trees are gone,"" stated Kern County Fire Department forester Jeff Gletne. ""It went from beautiful to a pretty naked area."" Bakersfield.com (Calif.), Feb. 21, 2018",Plants & Wildlife,"Kern County, CA, Bear Valley Springs, CA",
44092,California's State Water Project estimate at 20 percent of allocation,02/01/2018,01/30/2018, ,"The California Department of Water Resources announced that customers of the State Water Project would receive 20 percent of their requests, but the estimate could be revised upward as the snowpack deepens.  The initial allocation announced in December was 15 percent. Lake County News (Vacaville, Calif.), Jan. 30, 2018","Relief, Response & Restrictions, Water Supply & Quality","Alameda County, CA, Butte County, CA, Fresno County, CA, Kern County, CA, Kings County, CA, Los Angeles County, CA, Napa County, CA, Orange County, CA, Plumas County, CA, Riverside County, CA, San Bernardino County, CA, San Diego County, CA, San Luis Obispo County, CA, Santa Barbara County, CA, Santa Clara County, CA, Solano County, CA, Yuba City, CA, Tulare County, CA, Ventura County, CA",
48678,Fewer days of tule fog in California's San Joaquin Valley,10/30/2019,01/15/2018, ,"Drought has reduced the number of days when the San Joaquin Valley is shrouded in tule fog, reducing the number of school fog delays and closures. Bakersfield.com (Calif.), Jan. 15, 2018",Society & Public Health,"Fresno County, CA, Fresno, CA, Kern County, CA, Bakersfield, CA, Kings County, CA, Madera County, CA, Merced County, CA, San Joaquin County, CA, Stanislaus County, CA, Tulare County, CA",
43965,"Irrigation needed in the Sacramento, San Joaquin valleys in California",01/10/2018,12/15/2017, ,"Farmers in the Sacramento and San Joaquin valleys began irrigating in December to make up for the dry start to the water year, which began in October.  Farmers typically do not need to start irrigating until mid-May.  Given the dry conditions, two irrigation districts, the Modesto Irrigation District and Turlock Irrigation District, were considering offering a winter allocation. Ag Alert (Sacramento, Calif.), Jan. 10, 2018","Agriculture, Water Supply & Quality","Butte County, CA, Colusa County, CA, Fresno County, CA, Riverdale, CA, Glenn County, CA, Kern County, CA, Kings County, CA, Lake County, CA, Madera County, CA, Merced County, CA, Napa County, CA, Placer County, CA, Sacramento County, CA, San Joaquin County, CA, Shasta County, CA, Solano County, CA, Stanislaus County, CA, Modesto, CA, Turlock, CA, Sutter County, CA, Tehama County, CA, Tulare County, CA, Yolo County, CA, Yuba County, CA",
44566,"Lack of rainfall affecting livestock operation in Tehama County, California",04/09/2018,11/15/2017,04/03/2018,"Our ranch is located in northern California about 45 miles south of Redding, CA,  about 16 miles west of the I-5 corridor. Our nearest post office is Paskenta, CA.  Since our first rainfall on November 8, 2017 we have received 6.25"" of rain.  Our average for the year is around 22"". We have approximately 45 days remaining in our rainy season.        Our ranch consists of 6500 acres and has the carrying capacity, on a normal year, of 500 fall pairs for the grazing season, which consists of the months from November through mid May.  This provides 180 day season multiplied by 500 pairs equals 90,000 animal grazing days.      Our grass is O.K. at best.  To clarify, the quality is good, quantity is poor.  The rain has waited until the last possible day to arrive on every occasion thus far meaning we have had little rain, but it has arrived at just the right time to keep us going.       The drought is affecting our operation in multiple ways.      1. The first impact is our carrying capacity.   November 15 we brought in 300 fall pairs.  This is a little over half of what should have been brought in.  March 10 we brought in another 100 fall pairs and 60 spring calving cows.  This works out to: 300 pairs multiplied by 180 days equals 54,000 animal grazing days plus 100 pairs and 60 bred cows multiplied by only 60 days equals 9,600 animal grazing days for a total of 63,600 animal grazing days.  This is a 30% loss in carrying capacity.2. Rain  Runoff.  We depend on rain runoff to recharge stock ponds and to provide stream flow in seasonal creeks to provide drinking water.  We have been hauling water to one group of cows for 3 weeks.  The others will be fine for this year.3. Calf market weights.  We are projecting our market calves to be 40-70 pounds lighter due to lack of available feed and also having to sell animals sooner.  4. The greatest impact of 2017-2018 drought, in my opinion,  will be fall of 2018.  We have not received any runoff to recharge our stock ponds.  This will not allow us to graze cattle until we receive significant rain which will shorten our cattle grazing days for a second consecutive year.      The drought is really spotty in northern California.  Conditions change drastically within 30 miles of our operation; some for the better, most for the worst.       To summarize, to graze one cow for one day is $1.33  We will lose 26,400 animal grazing days this season for a loss of $35,112.  Add 400 fall pairs, which will yield 300 calves to sell weighing 560 pounds (last years average was 600 pounds) for a price of $1.50/lb equals $840.00 ($900.00 using last years weights) for a loss of $60.00 per calf multiplied by 300 equals $18,000 loss.  2018-2019 presents other potential losses with less animal grazing days.  There is a very good possibility we will not have any cattle until January 1, 2019, due to stock pond recharge,  which will be a 45-day loss of days.  45 days multiplied by 500 pairs equals 22,500 animal grazing days multiplied by $1.33 for a loss of $29,925.  This puts our total financial loss to $83,037.00, not counting losses from conception issues, lack of feed for replacements, lack of yield in hay production, etc...From Tehama County, California, on April 3, 2018","Agriculture, Plants & Wildlife, Water Supply & Quality","Tehama County, CA, Paskenta, CA",
41415,"New pricing model under discussion for Napa, California water customers",09/21/2017,09/20/2017, ,"The Napa City Council gave approval for the Water Division to adopt a new pricing model that would impose a minimum charge on all water customers. The utility needs to bolster revenue because water sales have steadily decreased since 2014 amid drought.  Some expenses remain constant, despite changes in water consumption, hence the need for the new minimum charge to create stable revenue.  A public hearing on the potential change will be held on Nov. 7.Napa Valley Register (Calif.), Sept. 20, 2017",Water Supply & Quality,"Napa, CA",
41180,"Water customers in Paradise, California urged to use more water",08/22/2017,08/18/2017, ,"The Paradise Irrigation District urged its customers to begin using more water because the drought has ended, water supplies were flush, and the district needed more revenue to cover various expenses.  It was suggested that people return to watering their lawns or plant flowers as a way to conservatively use more water.Chico Enterprise Record (Calif.), Aug. 18, 2017","Relief, Response & Restrictions, Water Supply & Quality","Butte County, CA, Paradise, CA",
40973,"Water culture changing in Sacramento, California",07/27/2017,07/25/2017, ,"Despite the end of the drought, Sacramento water officials have kept their twice-weekly lawn watering rules adopted during years of intense drought and would like to make permanent their stringent water restrictions to promote a culture of water conservation.  The Department of Utilities would like to change the city code to permit the use of sprinkler systems on just two days in non-drought years rather than three.  In the words of city utilities director Bill Busath, “We’re transitioning between an emergency drought response to a long-term, sustainable and efficient water-use culture in the city of Sacramento.”The Sacramento Bee (Calif.), July 25, 2017","Relief, Response & Restrictions, Water Supply & Quality","Sacramento, CA",
40826,"Water conservation still needed in Nipomo, California",06/29/2017,06/29/2017, ,"Nipomo residents must continue to conserve water, due to low groundwater levels, according to a report from the Nipomo Mesa Management Area Technical Group.  Groundwater levels in several wells analyzed in April indicated that the area was still in “severe water shortage conditions.”  Nipomo’s water table increased from 14.2 feet above mean sea level in 2016 to 15.6 feet, but was still below the 16.5-foot threshold considered to be severe water shortage conditions.  Santa Maria Sun (Calif.), June 29, 2017","Relief, Response & Restrictions, Water Supply & Quality","Nipomo, CA",
48677,"Drought-killed trees being replaced in Bakersfield, California",10/30/2019,06/11/2017, ,"Bakersfield was awarded a $193,000 grant to help replace the more than 3,200 trees killed by drought.  As a starting point, 913 trees will be planted in parks and disadvantaged areas, then school campuses in the Kern High and Delano school districts will also receive some trees.  Trees will also be planted near the “Welcome to Bakersfield” sign.  Planting will begin in October and was expected to take two years.Bakersfield.com (Calif.), June 11, 2017",Plants & Wildlife,"Bakersfield, CA",
53804,"Plans to resume tree planting in Fullerton, California",02/24/2021,06/01/2017,01/29/2021,"Drought and budget constraints made the city of Fullerton taper off its tree plantings in 2017, but a new $377,00 Cal Fire grant and $180,000 of city money will allow tree plantings to resume.Orange County Register (Calif.), Jan. 29, 2021",Plants & Wildlife,"Fullerton, CA",
40573,California growers and researchers developing drought defenses,05/19/2017,05/19/2017, ,"Growers and researchers were working fervently to find ways to help California’s orchards, vineyards and row crops withstand the next drought with as little water as they can manage and yet thrive.  Subsurface drip irrigation, minimizing soil disturbance, leaving crop residue, diversifying crop rotations and using cover crops are some of the strategies for improving moisture retention and drought tolerance.  Capital Press - Agriculture Weekly (Salem, Ore.), May 19, 2017",Agriculture,"Fresno County, CA, Parlier, CA, Kern County, CA, Kings County, CA, Madera County, CA, Merced County, CA, San Joaquin County, CA, Stanislaus County, CA, Tulare County, CA, Yolo County, CA",
39477,Water supplies still lacking in parts of California,04/19/2017,04/17/2017, ,"Residents in parts of Fresno, Kings, Tulare and Tuolumne counties still lacked running water, despite plentiful winter precipitation and the governor’s proclamation that the drought had ended.  Too many people in these counties still have water delivered to their homes because their wells were dry or contaminated.Twin Falls Times-News (Idaho), April 17, 2017","Relief, Response & Restrictions, Society & Public Health, Water Supply & Quality","Fresno County, CA, Kings County, CA, Hardwick, CA, Tulare County, CA, Tuolumne County, CA",
39251,Pacific Gas & Electric Company to check tree health near power lines in Northern California,03/03/2017,03/02/2017, ,"Pacific Gas & Electric Company crews were checking trees near power lines in Northern California to see how the trees were faring since the southern and central parts of Sierra Nevada region has seen millions of tree deaths.YubaNet (Nevada City, Calif.), March 2, 2017",Plants & Wildlife,"Butte County, CA, Bangor, CA, Honcut, CA, Yuba County, CA, Dobbins, CA, Loma Rica, CA, Rackerby, CA",
