Impact ID,Title,Post Date,Start Date,End Date,Description,Categories,Places,
32181,New problems with California water systems,09/04/2015,09/01/2015, ,"As California cities strove to curb water use, they encountered new problems unforeseen by water managers.  Tree roots, pipe corrosion and odors have become widespread issues for water systems that were not designed to rely heavily on gravity to move wastes.Los Angeles Times, Sept. 1, 2015","Business & Industry, Relief, Response & Restrictions, Water Supply & Quality","California, Los Angeles, CA, Orange County, CA, Yorba Linda, CA, Sacramento, CA, San Francisco, CA, Santa Margarita, CA",
32161,"Small community on edge of Tulare, California struggling with dry wells, praying for rain",09/01/2015,08/30/2015, ,"Domestic wells have run dry in Okieville, a small community on the edge of Tulare, leaving a group of residents to rig up a system and share water from a nearby well at a cost of $50 per month.  The manager of Tulare County’s Office of Emergency Services described such situations as “Third-World-type conditions.”Others have water trucked to their homes to refill 2,500-gallon water tanks that sit in the yard and get boxed drinking water, courtesy of the state’s $3.7 billion drought relief program.  Roughly 50 community members with dry wells were meeting together, trying to devise a manageable plan for getting running water for their homes again, but the water cannot flow soon enough for these people enduring another hot, dry summer.  Some people in the community resort to prayer for rain and relief from the drought.San Francisco Chronicle (SFGate.com), Aug. 30, 2015","Relief, Response & Restrictions, Society & Public Health, Water Supply & Quality","Tulare County, CA, Tulare, CA",
32164,"Water saving measures at jail in Orange, California",09/02/2015,08/29/2015, ,"Water-saving devices were being installed at the Theo Lacy jail in Orange to reduce the amount of water used in the facility.  Low-flow toilets, using 1.6 gallons of water rather than 3 gallons, were being tested to see how well they perform, given the many items inmates flush.  Installation of the 1,186 toilets would cost about $24,000.  New, water-saving timed shut-off valves were being installed in the showers to limit water waste.  One hundred forty-five valves were installed, with another 82 yet to be installed.  Each valve costs $6,000.A 3,000-square foot area previously covered with grass was replaced with free decomposed granite from Orange County Public Works.  Orange County Register (Calif.), Aug. 29, 2015","Relief, Response & Restrictions, Water Supply & Quality","Orange County, CA, Orange, CA",
32222,Californians continued to favor environmental protections,09/11/2015,08/29/2015, ,"Most California voters felt that drought had little to no effect on their daily lives, according to a recent USC Dornsife /Los Angeles Times poll.  Those surveyed also backed environmental protections and approved of the governor’s handling of the drought crisis.Los Angeles Times, Sept. 11, 2015","Society & Public Health, Water Supply & Quality","California, Kensington, CA",
32157,"Water, services available at Drought Resource Center in Porterville, California",08/31/2015,08/27/2015, ,"The Drought Resource Center in Porterville held an open house on Aug. 27 to highlight the services the center offers, such as free public showers, sinks and portable toilets.  People can also arrange bottled water pickup, household tank installation and water delivery.Fresno Bee (Calif.), Aug. 26, 2015","Relief, Response & Restrictions, Society & Public Health, Water Supply & Quality","Porterville, CA",
32137,"Assistance for California families confronted by dry wells, wildfires",08/28/2015,08/26/2015, ,"The California Drought Relief Fund, a crowd-funding campaign, was started by a group of non-profit organizations and businesses to offer assistance to California families touched by drought and wildfires.  The fund will support local relief organizations helping families who run out of water due to severe drought, mainly in the Central and Salinas valleys, and wildfire victims statewide.  All funds raised will be shared among three local relief organizations: Self-Help Enterprises, the Environmental Justice Coalition for Water and the California Fire Foundation.The Fresno Bee (Calif.), Aug. 26, 2015","Fire, Relief, Response & Restrictions, Society & Public Health, Water Supply & Quality","California, Fresno County, CA, Kern County, CA, Kings County, CA, Madera County, CA, Mariposa County, CA, Merced County, CA, Monterey County, CA, Greenfield, CA, King City, CA, Salinas, CA, Soledad, CA, San Joaquin County, CA, Atascadero, CA, Paso Robles, CA, Shandon, CA, Stanislaus County, CA, Tulare County, CA, Tuolumne County, CA",
32130,"Two nurseries closing in Laguna Beach, California",08/27/2015,08/26/2015, ,"Two nurseries in Laguna Beach announced plans to close their businesses, due to drought, changing consumers’ tastes, challenging economics for independent nurseries and rising property costs.  Los Angeles Times, Aug. 26, 2015","Business & Industry, Society & Public Health","Laguna Beach, CA",
32124,Group trying to stop Crystal Geyser from bottling water from Mount Shasta in California,08/27/2015,08/25/2015, ,"Crystal Geyser was the subject of a lawsuit filed in Napa County Superior Court by the group We Advocate Through Environmental Review (Water) which wants to prevent the company from bottling water from an aquifer that feeds the Sacramento River.  The group accused Crystal Geyser of failing to get the proper permits and violating land-use provisions if it goes ahead with plans to take water from Big Springs.  Siskiyou County was also named in the suit for allegedly disregarding its own rules and “rubber stamping” the plant, said the president of the nonprofit group’s board of directors.San Francisco Chronicle (SFGate.com) (Calif.), Aug. 25, 2015","Business & Industry, Society & Public Health, Water Supply & Quality","Napa County, CA, Calistoga, CA, Siskiyou County, CA, Big Springs, CA, Mount Shasta, CA",
32118,"Workshop about drought-tolerant landscaping held in Barstow, California",08/26/2015,08/25/2015, ,"A “Drought and Civic Beautification” workshop was held in Barstow in conjunction with Home Depot.  Participants learned about drought-tolerant landscaping.  Barstow Desert Dispatch (Calif.), Aug. 24, 2015",Society & Public Health,"Barstow, CA",
32119,"New firefighting mobilization center at Fairchild Air Force Base near Spokane, Washington",08/26/2015,08/24/2015, ,"A new firefighting mobilization center was set up at Fairchild Air Force Base near Spokane to battle fires in Washington.  The base will be the staging area for 20 large fire engines and 10 water tankers and will be managed by a team from San Diego.  Fire engines from Utah, Nevada, Arizona and Colorado were being brought in.Riverside Press-Enterprise (Calif.), Aug. 24, 2015","Fire, Relief, Response & Restrictions","Big Bear Lake, CA, Adams County, WA, Asotin County, WA, Benton County, WA, Chelan County, WA, Columbia County, WA, Douglas County, WA, Ferry County, WA, Franklin County, WA, Garfield County, WA, Grant County, WA, Kittitas County, WA, Klickitat County, WA, Lincoln County, WA, Okanogan County, WA, Pend Oreille County, WA, Spokane County, WA, Stevens County, WA, Walla Walla County, WA, Whitman County, WA, Yakima County, WA",
32109,"Summit Fire burning 100 acres near Snow Summit Ski Resort in San Bernardino County, California",08/24/2015,08/23/2015, ,"The Summit Fire blackened 100 acres of heavy brush and parched timber near the Snow Summit Ski Resort.  Mandatory and voluntary evacuations were underway.Los Angeles Times, Aug. 23, 2015",Fire,"San Bernardino County, CA, Big Bear Lake, CA",
32107,Water released to aid salmon in Klamath River in northern California,08/24/2015,08/22/2015, ,"The U.S. Bureau of Reclamation began releasing water from Lewiston Dam on the Trinity River on Aug. 21 in an effort to avoid a massive fish kill.  Water stored behind the Lewiston Dam is shared with farmers in the Central Valley who have in the past gone to court to try to stop the releases.  Water releases will continue through late September.The New York Times, Aug. 22, 2015","Plants & Wildlife, Relief, Response & Restrictions, Water Supply & Quality","Del Norte County, CA, Fresno County, CA, Humboldt County, CA, Kings County, CA, Siskiyou County, CA, Trinity County, CA, Lewiston, CA",
32112,"Trees dying in Hanford, California as city tries to meet state-mandated conservation goal",08/25/2015,08/22/2015, ,"Hanford was struggling to meet its mandated water conservation goal, but City Manager Darrel Pyle noted that 60 trees were dead or dying in the city’s parks because the city cannot water them.  “We are killing our urban forest.  I don’t know how much more we can ask our community members to do,” he said.The Fresno Bee (Calif.), Aug. 22, 2015","Plants & Wildlife, Relief, Response & Restrictions, Water Supply & Quality","Hanford, CA",
32106,"Emergency well project slowed in Menlo Park, California",08/24/2015,08/21/2015,08/20/2016,"A project to construct emergency wells on the east side of Menlo Park has been stalled for lack of manpower to complete the environmental review.  Staff has been reassigned to work on drought-related activities as mandated by the state.  San Jose Mercury News (Calif.), Aug. 21, 2015","Relief, Response & Restrictions, Society & Public Health, Water Supply & Quality","Menlo Park, CA",
32097,Insufficient water for Lake Elsinore Grand Prix in California,08/21/2015,08/20/2015,08/14/2017,"Drought prompted race organizers to hold the contest in the Lake Elsinore Motorsports Park in 2015 and 2016, which limited interest and participation.  Riverside Press-Enterprise (Calif.), Aug. 14, 2017The Lake Elsinore Grand Prix, scheduled for November, was canceled for lack of water.  Due to mandated water conservation, the Elsinore Valley Municipal Water District cannot provide the roughly 1 million gallons of potable water needed to rebuild and maintain the racetrack and control dust.  The district offered recycled water, but there were not enough access points to distribute the water to meet the Grand Prix’s needs.Riverside Press-Enterprise (Calif.), Aug. 20, 2015","Tourism & Recreation, Water Supply & Quality","Lake Elsinore, CA",
32081,"Town hall meeting in San Jose, California",08/18/2015,08/20/2015, ,"A town hall meeting to share drought information will be held in San Jose on Aug. 20.  Rep. Mike Honda will take part in a panel discussion featuring representatives from the U.S. Bureau of Reclamation, California Department of Water Resources, and Santa Clara Valley Water District.San Jose Mercury News (Calif.), Aug. 16, 2015","Relief, Response & Restrictions, Society & Public Health","San Jose, CA",
32177,"Midpines, California, drying trees, fires affecting people's breathing, wells drying, people having water delivered",09/04/2015,08/19/2015,08/19/2015,"A great many pines are dead or dying.  Many of the Sierra black oaks do not look healthy, and some are dead, along with other smaller scrub.  The fires certainly affect healthy breathing.  Several of our neighbors have to have water delivered, because their wells are dry.  CoCoRaHS Report from Station #Mariposa 3.7 NNW on 8/19/2015","Fire, Plants & Wildlife, Society & Public Health, Water Supply & Quality","Midpines, CA",
32093,High number of West Nile virus cases in California,08/20/2015,08/17/2015, ,"Butte County officials believed that drought is part of the reason for the high number of West Nile virus cases this year.  Thirty human cases have been detected in Butte County alone.  Eighty-eight mosquito groups—a record number—tested positive for the virus in the county.  The California Department of Human Health reported 36 human cases in 10 counties, including Butte, Glenn, Kern, Los Angeles, Nevada, Orange, Riverside, San Bernardino, Santa Clara and Tulare.  The state website updates its figures each Friday.Chico Enterprise Record (Calif.), Aug. 17, 2015","Plants & Wildlife, Society & Public Health","California, Butte County, CA, Chico, CA, Glenn County, CA, Kern County, CA, Los Angeles County, CA, Nevada County, CA, Orange County, CA, Riverside County, CA, San Bernardino County, CA, Santa Clara County, CA, Tulare County, CA",
32084,"Cuesta fire charred at least 300 acres in San Luis Obispo County, California",08/19/2015,08/17/2015, ,"The Cuesta fire charred at least 300 acres in San Luis Obispo County after the blaze was sparked by a vehicle which also started two other fires.  Embers jumped containment lines, carrying the fire toward Santa Margarita.  The blaze was 5 percent contained and was being worked by more than 250 firefighters.Years of drought and sustained heat have made California’s vegetation extremely susceptible to fire.Los Angeles Times, Aug. 17, 2015",Fire,"San Luis Obispo County, CA, Santa Margarita, CA",
32070,"Drought, changes in lawnscaping practices helping, hurting lawn care business in Sacramento area",08/17/2015,08/13/2015, ,"Business at a lawn supply store in Citrus Heights was down over the past year, with revenue falling 12 percent.  Due to the drought, fewer people were gardening, needing gardening tools and repairs to gardening equipment.  Similarly, lawn mowing businesses had less work because Californians were opting for drought-tolerant plants or letting their lawns turn brown rather than cultivating a carpet of green grass.  Some lawn services were taking on new tasks, such as tearing out lawns and installing drought-tolerant landscaping, to keep busy.  One lawn maintenance service owner in Loomis noted that his business rose 25 percent in the past year with increased demand for lawn conversions and water efficient sprinklers.  One service assists customers with water management and helps them adjust their sprinklers to use water efficiently.The Sacramento Bee (Calif.), Aug. 13, 2015",Business & Industry,"Loomis, CA, Citrus Heights, CA",
32067,Shade balls to protect water in Los Angeles Reservoir,08/14/2015,08/12/2015, ,"Ninety-six million shade balls made from high-density polyethylene were dropped into the Los Angeles Reservoir to protect water quality, prevent algae growth and slow evaporation from the reservoirs.  The L.A. Reservoir has a surface of 175 acres and contains more than 3.3 billion gallons of water, 300 million of which are expected to be prevented from evaporating annually, thanks to the shade balls.  The project cost $34.5 million and was far cheaper than covering the reservoir with a more traditional protective cover.  The plastic balls do not leach any chemicals and ought to last 10 years.Los Angeles Times, Aug. 12, 2015","Relief, Response & Restrictions, Water Supply & Quality","Los Angeles County, CA, Los Angeles, CA",
32059,"Possible drought surcharge for American Canyon, California",08/13/2015,08/12/2015, ,"American Canyon may soon add a drought surcharge to water bills to make up for undercharging for water in past years and lost revenue as customers use less water amid drought.  The drought surcharge would tack on an additional $2 per unit of water used, amounting to an average increase of $20 monthly for residential water customers.  The administrative services director estimated that the temporary surcharge would be kept in place for six months.  The city council will consider the proposed surcharge at their Sept. 1 meeting.Napa Valley Register (Calif.), Aug. 12, 2015","Relief, Response & Restrictions, Water Supply & Quality","American Canyon, CA",
32074,"Desalination a possibility for increasing water supply for Antioch, California",08/17/2015,08/11/2015, ,"Antioch officials were considering a desalination system to increase the water supply.  The City Council approved a $100,000 contract with a consulting firm that will evaluate the feasibility of treating brackish water from the San Joaquin River, which has become saltier with less fresh water flowing into the Delta.  San Jose Mercury News (Calif.), Aug. 13, 2015","Relief, Response & Restrictions, Water Supply & Quality","Antioch, CA",
32520,"Toxic algae affected several lakes in Alameda County, California",02/11/2016,08/09/2015,02/09/2016,"Heavy winter rain and cold temperatures have improved water quality and lessened the amount of toxic algae in several Alameda County lakes.  Lake Temescal in Oakland and Lake Anza in Tilden Regional Park in Berkeley had been closed to swimming, due to the presence of harmful algae, but water quality has improved.  The beach at Quarry Lakes Recreation Area in Fremont has reopened for swimming since the blue green algae was gone.  San Jose Mercury News (Calif.), Feb. 9, 2016In Alameda County, popular swimming and picnicking areas at Lake Temescal in Oakland and Quarry Lake in Fremont were closed due to blue-green algae in the shallower than normal lakes.  The junior lifeguard program was canceled at Lake Temescal with the lake being low.San Jose Mercury News (Calif.), Aug. 9, 2015","Relief, Response & Restrictions, Society & Public Health, Tourism & Recreation, Water Supply & Quality","Berkeley, CA, Fremont, CA, Oakland, CA",
32032,"Many California lakes still open, some boat ramps closed",08/11/2015,08/09/2015, ,"A fourth dry winter in California has depleted rivers and reservoirs, making vacationers adjust their summer plans to find somewhere appropriate for the activities they desire.  Despite years of drought, travel spending continued to climb 3.6 percent in 2014 to $117.5 billion, with 2015 being on track to be another great year.  The owner of a river rafting business near Healdsburg took numerous calls from potential visitors wondering if rafting was still available.  There was adequate water for rafting, but patrons must be prepared to climb out and walk in shallow areas.  A reservation manager at Shasta Marina Resort was also taking many calls from people making sure there was enough waterDespite the abysmal appearances of Lake Shasta and Lake Don Pedro, given the drastic drop in water levels over the years, visitors have still enjoyed their stay at the lakes.At Shadow Cliffs in Pleasanton, migrating Canadian geese were making themselves comfortable on the sandy beaches, to the annoyance of beachgoers and park rangers.  The rangers use remote-controlled “Goosinators” to get the birds to move.  In previous years, the geese congregated on the lawn, which is unwatered this year and apparently less appealing to the geese.Lexington Reservoir in Santa Clara County was closed to recreational users because the water level no longer allowed the safe launch of canoes or any other vessels.At Lake Tahoe, many boat launches were closed, causing more traffic at the available launches.  The Truckee River wasn’t suitable for tubing or rafting because the river was a series of puddles.  A visitor near the Truckee River opted to rent a bike to ride along the river rather than tube down the river as they usually do.  San Jose Mercury News (Calif.), Aug. 9, 2015","Plants & Wildlife, Relief, Response & Restrictions, Society & Public Health, Tourism & Recreation, Water Supply & Quality","California, Alameda County, CA, Fremont, CA, Oakland, CA, Pleasanton, CA, Alpine County, CA, El Dorado County, CA, Nevada County, CA, Placer County, CA, Santa Clara County, CA, Shasta County, CA, Sierra County, CA, Sonoma County, CA, Healdsburg, CA, Carson City, NV, Churchill County, NV, Douglas County, NV, Pershing County, NV, Storey County, NV, Washoe County, NV",
32027,"Guadalupe River dry in San Jose, California",08/10/2015,08/08/2015, ,"Eight miles of the 14-mile Guadalupe River in San Jose went dry over the past couple of months, contributing to the absence or deaths of fish and other wildlife.  Water releases from four upstream reservoirs owned by the Santa Clara Valley Water District were effectively halved because years of drought have slashed reservoir storage.  Twelve of the about 30 primary miles of Coyote Creek were also dry.San Jose Mercury News (Calif.), Aug. 8, 2015","Plants & Wildlife, Water Supply & Quality","Santa Clara County, CA, San Jose, CA",
35818,"Emergency pumping barge no longer needed in Lake Cachuma, California",02/28/2017,08/01/2015,02/28/2017,"The emergency pumping barge that began sending water to the intake tower in August 2015 was no longer needed as the level of Lake Cachuma rose from about 7 percent at its lowest point to 46 percent of capacity on Feb. 27.Noozhawk (Santa Barbara, Calif.), Feb. 28, 2017An emergency pumping barge in Lake Cachuma, which was at 14 percent of capacity, needs to be moved to a deeper part of the lake.  The Goleta Water District, the City of Santa Barbara, the Montecito Water District, the Carpinteria Valley Water District and the Santa Ynez Improvement District all rely on the lake for water.KEYT-TV (Santa Barbara, Calif.), June 27, 2016","Relief, Response & Restrictions, Water Supply & Quality","Santa Barbara County, CA, Santa Barbara, CA",
35713,"Drought restrictions close splash pads in Riverside, California",06/16/2016,08/01/2015,06/17/2016,"Splash pads at six Riverside city parks were turned off in 2015 due to drought restrictions.  The splash pads began spraying again on June 17 to offer families free cooling relief from the hot temperatures and will continue to operate at least through June 30.Riverside Press-Enterprise (Calif.), June 15, 2016","Relief, Response & Restrictions, Tourism & Recreation, Water Supply & Quality","Riverside, CA",
31969,More leeches in California's waterways,07/31/2015,07/30/2015, ,"Some of California’s outdoor swimming areas, such as Lake Yosemite in Merced, have more leeches than usual, due to heat and drought this year.  Merced County officials posted notices near the beach, alerting swimmers to the increase in leech sightings in lakes, rivers and ponds statewide.KFSN-TV ABC 30 Frenso/Visalia (Calif.), July 30, 2015","Plants & Wildlife, Relief, Response & Restrictions, Society & Public Health","California, Merced, CA",
39034,"Two children injured by falling pine tree in Pasadena, California",12/19/2016,07/28/2015, ,"Two children were critically injured when a 70-foot tall pine tree suddenly fell on a group of children outside of the Kidspace Children’s Museum in Pasadena.  The tree emitted a cracking sound and began to fall, said a witness.  KTLA-TV WB 5 Los Angeles (Calif.), July 28, 2015An arborist concluded that the prolonged drought, the absence of strong roots and a spate of rainy days preceding the event were the main reasons the tree fell.Los Angeles Times (Calif.), Dec. 18, 2016","Plants & Wildlife, Society & Public Health","Los Angeles County, CA, Pasadena, CA",
31924,"Conflict, violence over water pumping in Tulare County, California",07/23/2015,07/22/2015, ,"Residents of Jones Corner, a small community near East Porterville in Tulare County, were angered by the trucks hauling water from their well to East Porterville, where many domestic wells ran dry in past years.  Although the well is 200 to 300 feet deep with water, residents do not like sharing their precious resource.  Jones Corner residents park cars in front of the well to prevent trucks from drawing water or follow trucks to see where they deliver the water.  Water truck drivers have been threatened by furious residents.  In one instance, a rock was thrown at a water truck, breaking a side window.  One driver was warned by a man that he had better watch his back, prompting the driver to call the sheriff.The Fresno Bee (Calif.), July 22, 2015",Society & Public Health,"East Porterville, CA, Jones Corner, CA, Porterville, CA",
31945,"Davis, California, fire",07/29/2015,07/22/2015,07/23/2015,"Lake Berryessa Fire began about 2:30 pm 7-22-15.  I noticed smoke in Woodland, California at 4:15pm, and by 4:30 smoke was thick with falling ashes. At 6:30 pm in Davis, the sky was dark with smoke and some falling ashes.  CoCoRaHS Report from Station #Davis 1.6 NNW on 7/23/2015",Fire,"Davis, CA",
31931,"Drought meeting with state officials in Redding, California",07/24/2015,07/22/2015, ,"State officials visited Redding to meet with local authorities and hear how drought was affecting the area.  The state officials were from the Governor’s Office of Emergency Services, the California Water Resources Control Board, the state Department of Fish and Wildlife and the state Department of Water Resources.Redding Record Searchlight (Calif.), July 22, 2015","Relief, Response & Restrictions, Society & Public Health","Redding, CA",
31928,"Dissent among Sacramento neighbors about green lawns, compliance with water restrictions",07/23/2015,07/21/2015, ,"A Curtis Park resident posted a comment on Nextdoor, a social networking website, expressing frustration about the prevalence of lush, green lawns in his neighborhood and doubt that those homeowners were observing the watering restrictions.  His post, which also noted the presence of two newly sodded lawns, sparked a flurry of responses, some agreeing with his comments, while others struck back, attacking him for being judgmental or defending their lush yards.The Sacramento Bee (Calif.), July 21, 2015",Society & Public Health,"Sacramento, CA",
31935,"Land subsidence put bridge in water in Fresno County, California",07/24/2015,07/21/2015, ,"The Russell Avenue bridge in western Fresno County was in the water because excessive pumping caused the land and bridge to sink.  Boaters used to be able to float beneath the bridge, but no longer can.KFSN-TV ABC 30 Frenso/Visalia (Calif.), July 21, 2015","Agriculture, Society & Public Health, Water Supply & Quality","Fresno County, CA, Firebaugh, CA",
