Impact ID,Title,Post Date,Start Date,End Date,Description,Categories,Places,
30252,"Farmers' water connections sealed in Terra Bella Irrigation District in Tulare County, California",04/09/2014,03/31/2014, ,"The Terra Bella Irrigation District (TBIG) notified its 600 farmers that they will receive no irrigation water this year for the first time in the district’s history because the district will not likely get any water from the federally-operated Friant-Kern canal.  The main crops in this area are citrus and pistachio trees—crops that cannot be left unwatered without substantial loss.  Water meters were sealed by the TBIG last month and tagged with a notice that says, “No irrigation water is available this year. Illegal use of irrigation water is subject to penalties. Your meter has been sealed.”  Those who cut the seal will be fined $10,000, but the irrigation district manager expects the fine will not deter some farmers.  “I’ve heard rumors that it may be worth paying the penalties to keep your trees alive, so we’ll see how it works,” said the district manager.  The district provides water to a $100 million citrus crop, and farmers, desperate to get water, have brought checks totaling $4 million to the district office to purchase water on their behalf.  The manager has not been able to find any water to purchase so far.The town of Terra Bella expects to receive half of the usual water supply from the Friant-Kern canal.  KQED Public Media (San Francisco, Calif.), April 8, 2014","Agriculture, Relief, Response & Restrictions, Water Supply & Quality","Tulare County, CA, Terra Bella, CA",
30220,"Increased water, sewer rates in Milpitas, California",03/28/2014,03/27/2014, ,"Milpitas residents were urged to curb their water use by 20 percent, but that will lead to an anticipated revenue shortfall of roughly $1 million for the utility company.  As a result, the city plans to raise water and sewer rates by 14.5 percent and 7 to 14 percent, respectively, to make up the shortfall beginning on July 28.  San Jose Mercury News (Calif.), March 27, 2014","Relief, Response & Restrictions, Water Supply & Quality","Milpitas, CA",
30205,"Water conservation in restaurants in Santa Cruz, California",03/26/2014,03/24/2014, ,"Water is no longer set in front of customers in Santa Cruz restaurants unless they request it as the city strives to conserve water.  Table signs from the Santa Cruz Water Department explain the new policy to customers. San Jose Mercury News (Calif.), March 24, 2014","Business & Industry, Water Supply & Quality","Santa Cruz, CA",
30469,"Drought surcharge for water customers in Roseville, California",06/04/2014,03/24/2014,01/22/2015,"The proposed surcharge in Roseville to encourage water customers to save water never was enacted.  The U.S. Bureau of Reclamation upped its water allocations for Roseville, making the surcharge unnecessary.  The city did allow underutilized parks and fields go dormant, according to the city’s water efficiency administrator.  Roseville nearly met the governor’s goal of 20 percent water conservation by reducing its water use by 19.4 percent compared with 2013.Sacramento Bee (Calif.), Jan 22, 2015The Roseville water utility said on June 2 that it will begin tacking on a drought surcharge equaling 15 percent of the monthly water usage charge starting June 15.  The temporary fee will be assessed to commercial and residential water customers and should amount to an average of $1 to $2 for most residential customers.  The city’s environmental utilities director said the fee was needed to balance the utility’s finances because drought conditions have brought higher operational costs, while requests for a 20 percent reduction in water use have dropped the utility’s revenue.Lower revenues and higher costs for outreach, staff and operational expenses have resulted in a projected deficit of $660,000 for the fiscal year ending June 30.  The drought surcharge should bring in $110,000 to offset the shortfall.  The remainder of the deficit will be covered with the utility’s $1 million rate stabilization reserve fund.  Sacramento Bee (Calif.), June 3, 2014Water customers of the Roseville water utility were told to cut back on water use by 20 percent to conserve water while the region was in drought.  In January, water users were urged to curb their water use by 20 percent, but have only achieved a reduction of 10 percent.  Sacramento Bee (Calif.), March 24, 2014","Relief, Response & Restrictions, Water Supply & Quality","Roseville, CA",
30218,Central Valley golf course to close,03/28/2014,03/23/2014,04/30/2014,"Diablo Grande plans to close its Legends 18-hole golf course in April or May when the condition of the grass deteriorates from the lack of water, but Legends will remain open until then.  The resort area has restrictions on water use, expects to pay higher water rates as the community buys extra water for an estimated $1,300 to $2,500 per acre-foot and is striving to reduce their water use to about one-third of normal.Modesto Bee (Calif.), March 23, 2014","Business & Industry, Tourism & Recreation, Water Supply & Quality","Patterson, CA",
30195,The Santa Clara Valley Water District in California informed seven cities and companies that they would receive just 80 percent of their requested treated drinking water through the end of the year,03/25/2014,03/21/2014,12/31/2014,"The Santa Clara Valley Water District informed seven cities and companies that they would receive just 80 percent of their requested treated drinking water through the end of the year.  Roughly 1.5 million people in San Jose, Mountain View, Sunnyvale, Cupertino, Milpitas and Santa Clara will be affected by the 20 percent cuts.  These communities may resort to groundwater pumping, urging residents to conserve and using other water supplies to compensate for getting less water from the SCVWD.A spokesman for the San Jose Water Company responded by stating that they will pump more groundwater from the 100 or so wells throughout the county and will strongly urge water conservation.  The SJWC has devised new rules for outdoor watering and days on which people may water, but at present were not fining violators of those rules.Only about 25,000 acre-feet of water will be put back into Santa Clara County’s underground aquifers this year, a reduction of 75 percent as the area endures drought.San Jose Mercury News (Calif.), March 25, 2014","Relief, Response & Restrictions, Water Supply & Quality","Santa Clara County, CA, Cupertino, CA, Milpitas, CA, Mountain View, CA, San Jose, CA, Santa Clara, CA, Sunnyvale, CA",
30181,The Los Angeles International Airport changed its welcoming ceremony for new airline service routes to conserve water,03/17/2014,03/16/2014, ,"The Los Angeles International Airport changed its welcoming ceremony for new airline service routes from water cannons to a salute from LAX firefighters and their rigs lined up on the tarmac.  The state is enduring an intense drought that has limited water supplies.Los Angeles Times (Calif.), March 16, 2014","Society & Public Health, Water Supply & Quality","Los Angeles, CA",
30206,"Hesperia, California, huge fire",03/26/2014,03/14/2014,03/14/2014,"Thirty five plus acres vegetation fire in Gorman, low RH.  CoCoRaHS Report from Station #Hesperia 2.1 E on 3/14/2014",Fire,"Hesperia, CA",
30156,"Residents of Sacramento, California eager to remove turf for rebate",03/06/2014,03/05/2014, ,"Sacramento residents have the phones ringing off the hook at the Department of Utilities as they try to get in on a “cash for grass” program that the city council approved on March 4.  The city was working on implementing the program, but the first step is to schedule a “water wise house call” to have a water conservation specialist visit, measure the lawn and put the homeowner on a waiting list to take part in the lawn rebate plan.Sacramento Bee (Calif.), March 6, 2014","Relief, Response & Restrictions, Society & Public Health","Sacramento, CA",
30345,Fewer farmers selling at City Farmers’ Market in Civic Center in San Francisco,05/02/2014,03/02/2014,06/06/2014,"Drought and production challenges were keeping five or six small family farmers from bringing in fresh produce to sell at the City Farmers’ Market in Civic Center. Farmers are wary and anxious, hoping to have enough water to continue growing crops, but unsure, wondering what the summer holds in store. A grower of alfalfa and broccoli sprouts, pumpkins and Christmas trees has begun planting sprouts closer together and watering less frequently than he used to do.  He does not have any extra water for a personal garden and must be frugal with water while washing sprouts because the creek which supplies all of his water is drying up quickly.  He is worried and praying for rain.Another farmer in Merced who stopped bringing produce to the market was able to plant only one crop, instead of double-cropping.  In addition, he is only planting half of his 60 acres while he waits for the pump and pipes in his well to be replaced.  The water level has dropped considerably.He is also installing drip irrigation lines to conserve water .San Francisco Chronicle (SFGate.com), May 2, 2014 and June 6, 2014","Agriculture, Society & Public Health, Water Supply & Quality","Merced County, CA, San Francisco, CA, San Mateo County, CA",
30808,"Water use down in Redding, California",09/05/2014,03/01/2014,09/03/2014,"Residents of Redding cut their water use by 14 percent from March 1 through the end of August, according to the Redding Water Utility.  Water consumption in August dropped 23 percent, compared to August 2013, after the city council passed an emergency drought measure.  Redding Record Searchlight (Calif.), Sept. 3, 2014","Relief, Response & Restrictions, Society & Public Health, Water Supply & Quality","Redding, CA",
31489,Electric bills rose for Pacific Gas and Electric Co. customers in California,04/09/2015,03/01/2014,04/06/2015,"Pacific Gas and Electric Co., serving much of California from Eureka in the north to Bakersfield in the south, upped its electric rates 1.5 percent to compensate for less cheap energy from hydropower production, due to drought.  The rate increase took effect prior to March 2014.The Sacramento Bee (Calif.), April 6, 2015",Energy,"Alameda County, CA, Alpine County, CA, Amador County, CA, Butte County, CA, Calaveras County, CA, Colusa County, CA, Contra Costa County, CA, El Dorado County, CA, Fresno County, CA, Glenn County, CA, Humboldt County, CA, Inyo County, CA, Kern County, CA, Kings County, CA, Lake County, CA, Lassen County, CA, Madera County, CA, Marin County, CA, Mariposa County, CA, Mendocino County, CA, Merced County, CA, Mono County, CA, Monterey County, CA, Napa County, CA, Nevada County, CA, Placer County, CA, Roseville, CA, Plumas County, CA, Sacramento County, CA, Sacramento, CA, San Benito County, CA, San Francisco County, CA, San Joaquin County, CA, San Luis Obispo County, CA, San Mateo County, CA, Santa Barbara County, CA, Santa Clara County, CA, Shasta County, CA, Sierra County, CA, Solano County, CA, Sonoma County, CA, Stanislaus County, CA, Sutter County, CA, Tehama County, CA, Trinity County, CA, Tulare County, CA, Tuolumne County, CA, Yolo County, CA, Yuba County, CA",
30282,"Water conservation desired in Livermore, California",04/16/2014,02/28/2014,04/15/2014,"Livermore city officials asked for voluntary water conservation in February to stretch water supplies, but water consumption did not decrease as much as desired.On April 15, Livermore officials announced mandatory water restrictions with the aim of curbing water use by 20 percent.  Water customers must water at night, use buckets and hoses with shut-off nozzles to wash vehicles, among other conservation measures.  San Jose Mercury News (Calif.), April 15, 2014","Relief, Response & Restrictions, Water Supply & Quality","Livermore, CA",
30725,Montecito Water District in California not issuing new accounts or approving an increase in the size of existing meters,08/13/2014,02/28/2014,08/13/2014,"Montecito Water District has not issued new accounts or approved an increase in the size of existing meters since February 2014 because drought has reduced the area’s water supply.  There also is a moratorium on new swimming pools.The water district warned its customers that they would be out of water by July if water use was not reduced by 30 percent.  Customers responded by lowering their water use by 40 percent in one month.  The district also bought water from elsewhere in the state and foresees ending the year with a surplus.Penalties for excessive water use have paid for $1 million in supplemental water for Montecito.  People who use more than their allotment pay $30 per unit of water of 748 gallons, and $45 per unit for additional instances of water use beyond their allotment.    For the past three months, the district has collected about $500,000 per month in penalties.  One unfortunate customer had a penalty of $12,000 one month.Orange County Register (Santa Ana, Calif.), Aug. 13, 2014","Business & Industry, Relief, Response & Restrictions, Society & Public Health, Water Supply & Quality","Montecito, CA",
30141,"Woodward Reservoir in Stanislaus County, California to remain at low level",02/27/2014,02/27/2014, ,"The South San Joaquin Irrigation District board of directors voted to leave the Woodward Reservoir in Stanislaus County lower than normal, which would effectively close the reservoir for public recreation.  While the SSJID has senior water rights on the Stanislaus River, the district prefers to conserve water in the event that drought drags on into 2015.  The SSJID will save up to 9,691 acre-feet of water that would be lost to evaporation and seepage if it does not fill the reservoir, but will review the issue in April.The SSJID serves water customers in Tracy, Manteca and Lathrop.Stockton Record (Calif.), Feb. 27, 2014","Relief, Response & Restrictions, Water Supply & Quality","Lathrop, CA, Manteca, CA, Tracy, CA, Stanislaus County, CA",
30157,"Mandatory 25 percent water conservation in San Juan Water District near Sacramento, California",03/07/2014,02/26/2014, ,"The San Juan Water District imposed a stage 3 water warning, bringing mandatory water use restrictions of 25 percent as Folsom Lake continued to drop.  Pavement and buildings may not be washed, and restaurants must only serve water if the customer requests it.  The San Juan Water District provides water for roughly 265,000 people in Granite Bay, parts of Roseville and Folsom, and unincorporated portions of Sacramento County.  Water agencies in Citrus Heights, Orangevale and Fair Oaks also receive water from the SJWD and have taken steps to guard the water supply in Folsom Lake.Fair Oaks Water District began using wells rather than drawing water from Folsom Lake.  Other agencies were also striving to conserve water.Sacramento Bee (Calif.), Feb. 28, 2014","Relief, Response & Restrictions, Water Supply & Quality","Roseville, CA, Sacramento County, CA, Citrus Heights, CA, Fair Oaks, CA, Folsom, CA, Orangevale, CA, Granite Hills, CA",
30164,"Drought emergency in Santa Cruz, California; water rationing in store",03/11/2014,02/25/2014, ,"The Santa Cruz city council declared a drought emergency on Feb. 25, thereby cutting water supplies for large landscape users by two-thirds and for the city’s two golf courses by about 50 percent.  Businesses using more than 1 million gallons of water annually will be audited and will be asked to create a water conservation plan.  Water rationing begins in Santa Cruz on May 1 and allows residents up to 60 gallons per person per day or up to 249 gallons for a single-family home per day for indoor and outdoor use.  On average, 25 percent of the city’s overall water consumption goes to outdoor water use, so water users must either discontinue outdoor watering or drastically cut their indoor water use.  The average water use in Santa Cruz is 58 gallons of water per person per day.The water utility will send water bills monthly, rather than once every two months so residents can better monitor their water use and change their habits if necessary.  Water rates will increase for water users who consume more than their allotment of water.  The San Lorenzo River was flowing at 14 percent of average, and seasonal rainfall was 40 percent of average.San Jose Mercury News (Calif.), March 10, 2014","Business & Industry, Relief, Response & Restrictions, Society & Public Health, Water Supply & Quality","Santa Cruz, CA",
30140,"Required water release from Loch Lomond eased to conserve water for Santa Cruz, California",02/27/2014,02/25/2014, ,"California water regulators approved a plan put forth by Santa Cruz officials to release less than the required volume of water from Loch Lomond Reservoir to support fish habitat.  The temporary order will keep about 100 million gallons in the reservoir, or about 5 percent of the volume presently in the reservoir.San Jose Mercury News (Calif.), Feb. 25, 2014","Relief, Response & Restrictions, Water Supply & Quality","Santa Cruz, CA",
30121,"Nine thousand acres of land unplanted near Coalinga, California",02/24/2014,02/24/2014, ,"Nine thousands acres of vegetables near Coalinga, including 3,000 acres of lettuce were not planted due to the water shortage, stated the executive vice president of Harris Farms in Coalinga.  The forced fallowing of the acres normally devoted to lettuce will result in the loss of 72 million heads of lettuce and 700,000 hours of work for field workers.One thousand acres of almonds may soon be next for removal as the farm cuts back on water needs where possible.  Insects infest unwatered almond trees and spread into nearby fields, so the trees cannot be ignored for a season with the hope that they might survive.Sacramento Bee (Calif.), Feb. 24, 2014","Agriculture, Society & Public Health","Fresno County, CA, Coalinga, CA",
30125,The California Department of Water Resources was selling $165.3 million worth of bonds,02/25/2014,02/24/2014, ,"The California Department of Water Resources was selling $165.3 million worth of bonds to finance a reservoir expansion east of Los Angeles and the construction of pipelines connecting with suburbs in San Bernardino County.Drought has little bearing on the creditworthiness of the California Department of Water Resources, said Moody’s Investors Service in a Feb. 14 report.  The 29 local agencies that purchase water from the state must pay whether or not they receive water.Washington Post (D.C.), Feb. 24, 2014",Water Supply & Quality,"Alameda County, CA, Butte County, CA, Fresno County, CA, Kern County, CA, Kings County, CA, Los Angeles County, CA, Napa County, CA, Orange County, CA, Plumas County, CA, Riverside County, CA, San Bernardino County, CA, San Diego County, CA, San Luis Obispo County, CA, Santa Barbara County, CA, Santa Clara County, CA, Solano County, CA, Yuba City, CA, Tulare County, CA, Ventura County, CA",
30315,Abundance of rats in Heron Head's Park in San Francisco,04/24/2014,02/24/2014,04/24/2014,"Heron Head’s Park in San Francisco has been overrun by large rats the past two months, which has been startling to people and exhilarating to dogs romping in the park.  The park is normally a lovely place to stroll and has a dog park and lots of dog walkers, but the abundant, and often bold, rats have upset park goers.A contracted pest agency, hired by the Port of San Francisco, was setting humane traps and stopping up rat holes for the past two weeks.  They’ll continue battling the rats until the pests are gone.The owner of an animal removal company said that the warm spring likely led the rats to reproduce earlier than usual, so there are more of them right now.  In addition, drought has the pests on the move in search of water, as many other animals, such as raccoons, skunks and snakes, are also doing.   San Francisco Chronicle (SFGate.com), April 24, 2014","Plants & Wildlife, Society & Public Health","San Francisco, CA",
30128,"Almond grower in Mendota, California spent $1.1 million for two new wells",02/25/2014,02/24/2014, ,"A Mendota almond grower spent $1.1 million for two new wells for his 1,200-acre almond orchard to hopefully provide about 75 percent of normal irrigation.  Since next year’s almonds depend on sufficient water this year, low water supplies may doom next year’s nuts.  The almond grower fears that his almond production in 2014 may be down 25 percent, due to limited water in 2013.  Washington Post (D.C.), Feb. 24, 2014","Agriculture, Water Supply & Quality","Mendota, CA",
30142,"Low level of Folsom Lake threatens businesses in Folsom, California",02/28/2014,02/24/2014, ,"Mandatory water restrictions forced a sake maker in Folsom to shut down its decorative fountain in the company’s main lobby.  The owner of Gekkeikah Sake is worried that the low level of Folsom Lake will slow production this summer. The Kikkoman Soy Sauce company also uses water from Folsom Lake in the production of its soy sauce and will suffer if the lake level continues to decline.CBS13/CW31 Sacramento (Calif.), Feb. 24, 2014","Business & Industry, Relief, Response & Restrictions, Water Supply & Quality","Folsom, CA",
30158,"Drought alert for customers of West Basin Municipal Water District in Los Angeles County, California",03/07/2014,02/24/2014, ,"The West Basin Municipal Water District board of directors declared a drought alert, urging its water customers to adopt water conservation measures and meet the governor’s goal of reducing water use by 20 percent.  The West Basin Municipal Water District provides water for nearly one million people in Los Angeles County.Riverside Press-Enterprise (Calif.), March 4, 2013","Relief, Response & Restrictions, Water Supply & Quality","Los Angeles County, CA, Carson, CA, Culver City, CA, El Segundo, CA, Gardena, CA, Hawthorne, CA, Hermosa Beach, CA, Inglewood, CA, Lawndale, CA, Lomita, CA, Manhattan Beach, CA, Palos Verdes Estates, CA, Rancho Palos Verdes, CA, Redondo Beach, CA, Rolling Hills, CA, Rolling Hills Estates, CA, Torrance, CA, West Hollywood, CA",
30120,"The faithful gathered in Bakersfield, California to pray for rain",02/24/2014,02/23/2014, ,"More than 1,000 people from more than 30 churches gathered in the Bakersfield High School to pray for rain as California endured its third dry winter.  The Sunday event was the first of several community prayer events to relieve the drought.  Area churches will have 40 days of prayer beginning on May 1 and will conclude the days of prayer with the Global Day of Prayer on June 8.  Bakersfield Californian (Calif.), Feb. 23, 2014",Society & Public Health,"Bakersfield, CA",
30119,"Drought a factor in rodent infestation in Oak View, California",02/24/2014,02/20/2014, ,"Drought and others factors are thought to be partially responsible for the rodent problem at Oak View Elementary School.  Orange County Register (Santa Ana, Calif.), Feb. 20, 2014",Plants & Wildlife,"Oak View, CA",
30101,"Public works employees in Pacifica, California adjusted timers so sprinklers deliver just enough water to keep grass and plants alive",02/19/2014,02/18/2014, ,"Pacifica public works employees adjusted timers so sprinklers deliver just enough water to keep grass and plants alive as the community aims to conserve water.  Staff is also keeping an eye out for malfunctioning toilets and sprinkler systems.  Residents also strove to conserve water by showering every other day and flushing less often, among other water-saving measures.  San Jose Mercury News (Calif.), Feb. 18, 2014","Relief, Response & Restrictions, Water Supply & Quality","Pacifica, CA",
30095,California drought briefing,02/17/2014,02/14/2014, ,"A statewide drought briefing, sponsored by the Association of California Water Agencies, the County Supervisors Association of California, the League of California Cities, the California Farm Water Coalition, the California Farm Bureau Federation and others was held on Feb. 14. League of California Cities (Sacramento, Calif.), Feb. 4, 2014","Relief, Response & Restrictions, Society & Public Health","California, Sacramento, CA",
30099,Lady Gaga to do a public service announcement encouraging water conservation in California,02/19/2014,02/14/2014, ,"In exchange for use of the Neptune Pool at Hearst Castle near San Simeon, Lady Gaga agreed to donate a quarter of a million dollars to castle maintenance and repair, to promote the castle and water conservation on social media and also to make a water conservation public service announcement.   Gov. Jerry Brown wrote Lady Gaga a letter of thanks for the aid and assistance she provided to the state park and beyond.Sacramento Bee (Calif.), Feb. 14, 2014","Relief, Response & Restrictions, Society & Public Health, Water Supply & Quality","San Luis Obispo County, CA, San Simeon, CA",
30112,Salt accumulation in soil of strawberry fields in Southern California,02/21/2014,02/13/2014, ,"The lack of rain has led to salt buildup in strawberry fields in the Salinas in Monterey County, Watsonville in Santa Cruz County and near Oxnard in Ventura County, stated the director of berry operations for Naturipe Berry Growers Inc., Salinas, Calif.The Packer (Lenexa, Kan.), Feb. 13, 2014",Agriculture,"Monterey County, CA, Salinas, CA, Santa Cruz County, CA, Watsonville, CA, Ventura County, CA, Oxnard, CA",
30080,"Stage one drought emergency in Carpinteria, California",02/14/2014,02/12/2014, ,"The Carpinteria Valley Water District board of directors pronounced a stage one drought emergency and considered options for accessing more water.Santa Barbara News-Press (Calif.), Feb. 13, 2014","Relief, Response & Restrictions, Water Supply & Quality","Carpinteria, CA",
