Impact ID,Title,Post Date,Start Date,End Date,Description,Categories,Places,
31223,East Bay Municipal Utility District in California considering purchase of federal water from Sacramento River,12/19/2014,12/18/2014, ,"The rate hike for East Bay has been suspended until the East Bay Municipal Utility District decides whether to pump Sacramento River water. The start of the pumping and the surcharge could begin on Jan. 19 if the district chooses to move ahead with the plan.San Jose Mercury News (Calif.), Jan. 6, 2015Despite the recent storms, the East Bay Municipal Utility District will raise water rates 14 percent for the next few months to pay for extra federal water.  The EBMUD board voted to buy water from the Sacramento River and request a further reduction in water use from 10 percent to 15 percent.  If the region gets heavy storms in the next few weeks, the water purchase and uptick in water rates may not happen.San Leandro Times (Calif.), Dec. 18, 2014","Relief, Response & Restrictions, Water Supply & Quality","Alameda County, CA, San Leandro, CA, Contra Costa County, CA",
31218,Possible rate hike in Alameda County Water District in California,12/18/2014,12/17/2014, ,"The Alameda County Water District’s board of directors was considering the possibility of another rate hike in 2015 for the 13th straight year.  Drought has pushed up expenses which the agency passes on to customers.  The general manager for the ACWD said the goal was to increase revenue by 8 percent.  Unfortunately as customers use less water, the agency takes in less revenue and must increase water rates.A drought surcharge which took effect in July remained in effect.  San Jose Mercury News (Calif.), Dec.","Relief, Response & Restrictions, Water Supply & Quality","Alameda County, CA, Fremont, CA, Newark, CA, Union City, CA",
31209,California Water Resources Control Board held a public workshop,12/17/2014,12/16/2014, ,"The California Water Resources Control Board held a public workshop to talk about potential measures for urban water conversation in case the drought continues into its fourth year.Sacramento Bee (Calif.), Dec. 15, 2014","Relief, Response & Restrictions, Society & Public Health","Los Angeles, CA",
31212,"Water agreement to bank excess water in wet years for Bay Area, California",12/17/2014,12/16/2014, ,"The San Francisco Public Utilities Commission, San Bruno, Daly City and the California Water Services Company agreed to a $113 million plan to diversify the region’s water supply to guard against drought and other disasters.  The SFPUC will sell Hetch Hetchy water to Daly City and San Bruno in wet years and allow them to bank rainwater in the aquifer.  In drier years, they can draw on the banked water.  KTVU-TV Oakland, San Francisco, Bay Area (San Francisco, Calif.), Dec. 16, 2014","Relief, Response & Restrictions, Water Supply & Quality","Livermore, CA, Chico, CA, Oroville, CA, Selma, CA, Willows, CA, Bakersfield, CA, East Los Angeles, CA, Redwood Valley, CA, King City, CA, Salinas, CA, San Francisco, CA, Stockton, CA, Bayshore, CA, Daly City, CA, San Bruno, CA, Westlake, CA, Los Altos, CA, Dixon, CA, Visalia, CA, Marysville, CA",
31175,"Drought, construction bring donkeys into Riverside, California",12/10/2014,12/09/2014, ,"Drought and construction have pushed Riverside’s donkeys into neighborhoods where some residents fear the animals will graze on their flowers or other vegetation.  Other people like the donkeys and feed them, but people are encouraged to feed donkeys away from roadways because more donkeys than usual are being struck and killed by vehicles.KABC-TV ABC 7 Los Angeles, Dec. 9, 2014","Plants & Wildlife, Society & Public Health","Riverside, CA",
31159,"About 25 percent of the Christmas tree crop died in eastern San Bernardino County, California",12/08/2014,12/06/2014, ,"About 25 percent of the Christmas tree crop on a farm in Mentone in eastern San Bernardino County died this year due to drought and less than 40 percent of average water supplies.  San Jose Mercury News (Calif.), Dec. 6, 2014","Agriculture, Plants & Wildlife","Mentone, CA",
31155,Drought damaging California's Christmas trees,12/05/2014,12/03/2014, ,"California-grown Christmas trees suffered from drought. The assortment of potted Christmas trees at a South Bay nursery had fewer classic Christmas pines because those required more water than spruce. Baby trees and seedlings near Sacramento were the first to succumb to the drought, but adult trees with deeper roots managed to do better.  More interior browning and needle drop than usual plagued the trees.Los Angeles Times, Dec. 3, 2014","Agriculture, Plants & Wildlife","Alameda County, CA, El Dorado County, CA, Redondo Beach, CA, Sacramento County, CA, San Francisco County, CA, San Mateo County, CA, Santa Cruz County, CA",
32522,"Unhealthy algae levels in Lake Chabot in Castro Valley, California",02/11/2016,12/01/2014,02/09/2016,"Unhealthy algae concentrations at Lake Chabot in Castro Valley prompted officials to post signs warning dog owners to keep pets away from the water because three canines died after drinking lake water in late 2014 and early 2015.San Jose Mercury News (Calif.), Feb. 9, 2016","Relief, Response & Restrictions, Society & Public Health, Tourism & Recreation, Water Supply & Quality","Castro Valley, CA",
31283,"Bakersfield, California water conservation, push for more conservation",01/15/2015,12/01/2014,01/14/2015,"Citizens of Bakersfield trimmed their water use from 179 gallons per capita daily in November to 138 in December, making December’s water use more than 12 percent lower than the previous December when people used 158 gallons per capita daily.The water content at Isabella Lake was about 44,900 acre-feet, down from the average of 260,000 acre-feet this time of year.A push for more water conservation was underway in Bakersfield as officials highlighted incentives on water-saving appliances and energy-saving home improvements.  Bakersfield Californian (Calif.), Jan. 14, 2015","Relief, Response & Restrictions, Society & Public Health, Water Supply & Quality","Bakersfield, CA",
31143,California’s Department of Water Resources announced water allocation estimate,12/03/2014,12/01/2014,03/02/2015,"The State Water Project increased its allocation estimate to 20 percent of contracted amounts, up from its January estimate of 15 percent.  While the uptick is an improvement, this amount would be the SWP’s second lowest water delivery since 1990.  The additional water helps water agencies, but many will have to rely on groundwater and carefully manage supplies to get through the year.The Fresno Bee (Calif.), March 2, 2015Estimated water deliveries from the State Water Project rose from 10 percent to 15 percent with the California Department of Water Resources’ Jan. 15 announcement.  Continued water conservation could help water deliveries go up even further, said the DWR Director Mark Cowin.  The statewide water equivalent in the Sierra Nevada was 4.9 inches or 36 percent of normal for Jan. 15.  Lake Oroville in Butte County held 39 percent of its capacity of 3.5 million acre-feet.  Shasta Lake, the largest reservoir in the state and for the Central Valley Project, was 42 percent of capacity of 4.5 million acre-feet, amounting to 66 percent of its historical average for this time of year.   San Luis Reservoir contained 47 percent of its capacity of 2 million acre-feet, which was 65 percent of normal for Jan. 15.  Bakersfield Californian (Calif.), Jan. 15, 2015California’s Department of Water Resources announced an initial water allocation of 10 percent from the State Water Project, based on a more optimistic rain and snow forecast for 2015.  The estimate could be revised downward if the precipitation does not materialize.  Only 5 percent was delivered in 2014.Fresno Bee (Calif.), Dec. 1, 2014","Relief, Response & Restrictions, Water Supply & Quality","Alameda County, CA, Butte County, CA, Fresno County, CA, Kern County, CA, Kings County, CA, Los Angeles County, CA, Napa County, CA, Orange County, CA, Plumas County, CA, Riverside County, CA, San Bernardino County, CA, San Diego County, CA, San Luis Obispo County, CA, Santa Barbara County, CA, Santa Clara County, CA, Solano County, CA, Yuba City, CA, Tulare County, CA, Ventura County, CA",
31253,"Pricey water for Huron, California",01/12/2015,12/01/2014, ,"The town of Huron spent $57,000 in late 2014 for a small quantity of river water that was exhausted within weeks.  The price tag for the water was ten times the normal rate.  Federal officials will cover the cost of the water for the town of 6,700 people.The Fresno Bee (Calif.), Jan. 10, 2015","Relief, Response & Restrictions, Water Supply & Quality","Huron, CA",
31151,"Sacramento, California moving ahead of schedule on installing water meters",12/04/2014,11/30/2014, ,"Sacramento officials were aiming to install water meters for the remaining 62,000 unmetered homes as the city strives to monitor water use during drought.  The Sacramento city manager said that he was eager to get more of the meters installed to keep track of the amount of water being used and pinpoint some of the larger water wasters in the city.  Water meters help with water conservation because the bill reflects the amount of water used, so larger bills may prompt some to cut water use.  The flat rate for an unmetered connection is $41 for an average home.Sacramento Bee (Calif.), Nov. 30, 2014","Relief, Response & Restrictions, Water Supply & Quality","Sacramento, CA",
31054,"Drought meeting in Middletown, California",11/11/2014,11/24/2014, ,"A drought meeting will be held in Middletown on Nov. 24 to discuss the water supply and the relationship between surface water and groundwater.  Dr. Thomas Harter, Cooperative Extension hydrologist with the Department of Land, Air and Water Resources at UC Davis will speak, as will Chris Rogers, senior field representative from Assembly Member Mariko Yamada’s office.Napa Valley Register (Calif.), Nov. 10, 2014","Relief, Response & Restrictions, Society & Public Health","Middletown, CA",
31135,"More restrictions on water use in Indio, California",11/25/2014,11/24/2014, ,"The Indio City Council passed the second stage of the “Water Shortage Contingency Plan” to curb water use.  Some of the new restrictions include specific hours for lawn watering, recycled water for car washes and requiring customers to request water in restaurants rather than automatically receiving it.Palm Springs Desert Sun (Calif.), Nov. 24, 2014","Relief, Response & Restrictions, Water Supply & Quality","Indio, CA",
31127,Water conservation urged in San Francisco,11/24/2014,11/24/2014,02/09/2015,"The San Francisco Public Utilities Commission asks residents to curb their water use by 10 percent while the drought continues.  (SFGate.com) (San Francisco), Nov. 24, 2014 and Feb. 9, 2015","Relief, Response & Restrictions, Water Supply & Quality","San Francisco, CA",
31126,Groundwater to be blended with pristine water for San Francisco,11/24/2014,11/24/2014, ,"San Francisco water authorities are planning to add groundwater to the city’s drinking water to stretch their normal water supplies from the Hetch Hetchy Reservoir.  The Sierra runoff, held in the reservoir, is some of the purest water in the nation, while the groundwater is laden with minerals and nitrates above state standards.  Blind taste tests showed a slight preference for the Hetch Hetchy water over water combined with groundwater, but 20 percent said they had no preference.  The groundwater will be blended with the Sierra runoff starting in late 2015 or 2016 and will supply about 60 percent of the city, mainly on the west side.  During dry stretches, all of the city will get the blended water.  The water-blending project will run about $66 million.San Francisco Chronicle (SFGate.com), Nov. 24, 2014",Water Supply & Quality,"San Francisco, CA",
31131,"New temporary drought rate structure to boost revenue for water sales in Montecito, California",11/24/2014,11/23/2014, ,"Montecito residents have conserved plenty of water with water sales since July 1 at 49 percent below last year’s sales for the same time frame.  As a result, the Montecito Water District has less revenue and will end the year $4 million in the red if the trend continues.  Water restrictions violators have paid $1.58 million in fines, but the water utility still comes up short.  The water utility intends to use a temporary drought rate structure to increase revenue while water sales are low.Noozhawk (Santa Barbara, Calif.), Nov. 23, 2014","Relief, Response & Restrictions, Water Supply & Quality","Montecito, CA",
31123,"Man in Upland, California in trouble for conserving water, allowing lawn to turn brown",11/21/2014,11/21/2014, ,"An Upland man may have to pay $4,000 in fines or be jailed for six months for refusing to keep his lawn green.  Upland officials say he is in violation of the law by allowing his lawn to turn brown.  The man was charged with two misdemeanors for not properly maintaining his front lawn and parkway, but was given options to remedy the situation, which he did not take.  Officials said he could avoid a trial by paying the fines and correcting the problem or by submitting a drought-tolerant landscaping plan.The man asserts that he is being a responsible citizen by conserving water.San Jose Mercury News (Calif.), Nov. 21, 2014","Relief, Response & Restrictions, Society & Public Health, Water Supply & Quality","Upland, CA",
31118,"Groundwater recovery plant in San Juan Capistrano, California not producing as much water as anticipated",11/20/2014,11/19/2014, ,"The San Juan Capistrano groundwater recovery facility normally produces as much as 50 percent of the city’s drinking water, but low groundwater levels have dropped production to 30 percent.  The city stopped using two of its eight wells to allow the basin to recharge, but drought continues to cause the level of the remaining six wells to drop.Orange County Register (Santa Ana, Calif.), Nov. 19, 2014The groundwater recovery plant, leased and operated by San Juan Capistrano, was not producing as much water as anticipated, due to depleted groundwater levels.  The city, however, still owed more than $40 million for the plant.Orange County Register (Santa Ana, Calif.), Nov. 19, 2014","Relief, Response & Restrictions, Water Supply & Quality","Orange County, CA, San Juan Capistrano, CA",
31139,"Water waste in Visalia, California irritated city officials, residents",11/26/2014,11/19/2014, ,"Visalia officials and residents were irritated by the release of 540,000 gallons of water into a street gutter at a time when city residents were striving to save water during drought.  California Water Service and two governmental agencies were searching for the source of chemical contamination in a well in southwest Visalia.  City officials were displeased because they were not informed of the plan to dump the water and such blatant water waste was offensive to residents.  The Visalia mayor pointed out that wells in two subdivisions were going dry, and the governor has asked Californians to reduce water use by 20 percent, but a state agency chose to waste water.  In addition, permission to pour such a quantity of water into the city’s sewer system was refused.  A California Water Service supervisor asserted that he got verbal permission to release the water into the storm drains.Residents also expressed their annoyance at the water waste.The Fresno Bee (Calif.), Nov. 25, 2014","Relief, Response & Restrictions, Society & Public Health, Water Supply & Quality","Visalia, CA",
31101,More California cities considering recycling water after three intense years of drought,11/18/2014,11/18/2014, ,"San Diego and other California cities are considering recycling water after three intense years of drought.  San Diegans, although they did not embrace the idea years ago, were seeing it as a drought-proof water supply.The Orange County Water District intends to boost recycled water production from 70 million gallons daily to 100 million gallons daily.  Recycled water has supplied Orange County homes since 2008.  The Santa Clara Valley Water District decided in September to construct water recycling facilities which may be used to purify water for Sunnyvale and western Santa Clara County.  San Francisco Chronicle (SFGate.com), Nov. 18, 2014","Relief, Response & Restrictions, Water Supply & Quality","Orange County, CA, San Diego, CA, Santa Clara County, CA, Sunnyvale, CA",
31112,"Goleta, California to fill up Lake Los Carneros",11/19/2014,11/18/2014, ,"The city of Goleta intends to save Lake Los Carneros from drying up by adding 500,000 gallons of water to the lake.  The public works director says the city has enough water to accomplish the task, but the project may be reconsidered if the intense drought continues into 2015.  It was down to only about 7 feet deep. Migratory birds depend on the lake, and hikers, bird watchers and nature lovers also would like to see a healthier, fuller lake.KEYT-TV ABC 3 Santa Barbara (Calif.), Nov. 18, 2014","Plants & Wildlife, Tourism & Recreation, Water Supply & Quality","Goleta, CA",
31105,Drought's effects on beef producers among factors leading to closing of San Francisco meat processing plant,11/19/2014,11/17/2014, ,"Marin Sun Farms will close its San Francisco meat processing plant at the end of 2014.  The rising cost of doing business and the lingering financial impacts from drought on beef producers made it a wise decision to shutter the San Francisco plant.  All Marin Sun Farms operations from harvesting, processing and distribution will be centralized in Petaluma.  San Francisco Chronicle (SFGate.com), Nov. 17, 2014","Agriculture, Business & Industry","San Francisco, CA, Petaluma, CA",
31111,"Irrigation data being gathered in Shasta County, California for an upcoming irrigation scheduling workshop",11/19/2014,11/16/2014, ,"A researcher from the University of California Cooperative Extension has been working with a rancher in eastern Shasta County to measure the efficiency of water use on irrigated pasture.  The information gleaned will be used to help growers make the best use of precious water during the epic drought and will be shared at a workshop on irrigation scheduling in McArthur in January.Capital Press - Agriculture Weekly (Salem, Oregon), Nov. 16, 2014","Agriculture, Society & Public Health","McArthur, CA, Shasta County, CA",
31092,"Roughly 1,252 dry wells in Tulare County, California; water tank systems being installed",11/17/2014,11/15/2014,08/30/2015,"Through the end of August 2015, there were 1,252 dry household wells in Tulare County, which was more than the rest of California put together.San Francisco Chronicle (SFGate.com), Aug. 30, 2015Roughly 1,200 homes in Tulare County continued to use temporary water tanks to provide water after wells went dry, and nearly that many homes were still without running water.  The tanks have been used for a year and were intended to be a temporary measure.The Washington Post (D.C.), July 5, 2015There were 810 dry wells in Tulare County, and funds from a $50,000 donation from Bank of the Sierra, Self-Help Enterprises, public funding and county agencies were helping people get tank systems set up before winter arrives.  With a tank hooked up to a home’s plumbing system, although the water is not potable, at least homes will have hot water for showers and flushing toilets.  The cost for a water tank system is $1,200 to $1,500 for materials, plus labor, said a community development manager for Self-Help.  The State Water Resources Control Board pays for bottled water for homes with dry wells.Fresno Bee (Calif.), Nov. 15, 2014","Relief, Response & Restrictions, Society & Public Health, Water Supply & Quality","Tulare County, CA, East Porterville, CA, Monson, CA, Porterville, CA",
31068,One thousand barrels to be used as rain barrels in Los Angeles,11/12/2014,11/15/2014,12/06/2014,"The city of Los Angeles will be giving out 1,000 soda syrup barrels, donated by Coca-Cola, to be used as rain barrels.  The barrels will be handed out at five events around the city where recipients will also receive conversion kits.  Los Angeles Times, Nov. 11, 2014","Relief, Response & Restrictions, Society & Public Health, Water Supply & Quality","Los Angeles, CA",
31093,"Short supply of potable water for delivery in Tulare County, California",11/17/2014,11/15/2014, ,"Some Tulare County water suppliers are having trouble finding water to deliver to homes with dry wells.  One of two water haulers in the county with a license to deliver potable water ended his service because a municipal supplier could not provide him with water any longer. The Fresno Bee (Calif.), Nov. 15, 2014","Business & Industry, Water Supply & Quality","Tulare County, CA, Monson, CA",
31076,"Contaminated wells near Lake Tahoe, California",11/13/2014,11/12/2014, ,"Three wells in South Lake Tahoe were found to have high levels of a carcinogen, PCBE, often associated with dry cleaning, as drought causes groundwater levels to fall, concentrating contaminants in the existing water.  The Lahontan Water Quality Control Board said that the PCBE concentration was nine times the allowable level in two wells, leading to the closing of those wells.  One well remained in use and barely produces enough water for 950 homes.A well near Stateline was contaminated with MTBE from a gas station.  The gas station owner has to buy bottled water for a motel that depends on the well.	Capital Public Radio (Sacramento, Calif.), Nov. 12, 2014","Relief, Response & Restrictions, Society & Public Health, Water Supply & Quality","South Lake Tahoe, CA, Stateline, CA",
31082,"Nearly 6,000 Californians committed to not washing their cars for “Dirty Car Pledge”",11/14/2014,11/12/2014,11/23/2014,"Malibu is also participating in leaving their city vehicles dirty to conserve water.Los Angeles Times, Nov. 23, 2014Nearly 6,000 Californians have committed to not washing their cars to conserve water and raise drought awareness as they take part in Los Angeles Waterkeeper’s “Dirty Car Pledge.”  More than 300 Santa Monica city vehicles are staying dirty to conserve water, and Burbank was not washing more than 350 vehicles for 60 days.Santa Monica Mirror (Calif.), Nov. 13, 2014","Society & Public Health, Water Supply & Quality","California, Santa Monica, CA",
31053,"Water table fell in Tulare, California, leading city to lower its well pumps",11/10/2014,11/08/2014, ,"A water line connects Matheny Tract to Tulare, from which the small community hoped to get water.  Tulare has said that it cannot provide the water because one well was taken out of use because it was contaminated with arsenic.  Another problem was that drought caused the water table to fall, prompting the city to lower well pumps to maintain water pressure.Fresno Bee (Calif.), Nov. 8, 2014",Water Supply & Quality,"Tulare County, CA, Tulare, CA",
31064,U.S. Drought Monitor seminar at UC Davis,11/12/2014,11/07/2014, ,"U.S. Drought Monitor authors co-presented a seminar at the University of California in Davis on Nov. 7 to explain to California growers how the drought map comes together each week and to invite anyone to share drought impact information to get a more accurate picture of drought conditions statewide.  People were also urged to submit impact information and photos to the Drought Impact Reporter.  Capital Press (Salem, Ore.), Nov. 10, 2014","Agriculture, Relief, Response & Restrictions","California, Davis, CA",
31040,Bottling and selling of Sacramento's municipal water angers protesters,11/06/2014,11/06/2014, ,"Protesters blocked the truck entrances to a Nestlé Waters North America bottling plant in Sacramento to express their disapproval of the corporation’s bottling and selling of the city’s municipal water.  As drought continues in the region, people are taking a greater interest in their water supplies and how the water is used.  Nestlé pays the same rate for Sacramento municipal water as other industrial users pay. The plant has operated in South Sacramento since 2010.  Capital Public Radio (Sacramento, Calif.), Nov. 6, 2014",Society & Public Health,"Sacramento, CA",
31025,California State Board of Food and Agriculture meeting with state and federal officials to talk drought planning,11/05/2014,11/04/2014, ,"The California State Board of Food and Agriculture met with state and federal officials to talk about drought planning and implementation of the California Water Action Plan, which addresses sustainably using water resources in the state.  Sacramento Bee (Calif.), Nov. 3, 2014","Agriculture, Relief, Response & Restrictions, Society & Public Health, Water Supply & Quality","Sacramento, CA",
31022,"Food available for drought-affected families in Kern County, California",11/04/2014,11/01/2014,02/28/2015,"Emergency prepackaged foods will be given to Kern County residents who can offer proof of underemployment or unemployment due to drought.  Fourteen food distribution events will be held in February.Bakersfield Californian, Jan. 27, 2015The Community Action Partnership of Kern Food Bank has boxes of food available for families who have been hurt by drought.  Food will be distributed in Bakersfield, Buttonwillow, Lamont and Arvin.Bakersfield Californian, Nov. 1, 2014","Relief, Response & Restrictions, Society & Public Health","Kern County, CA, Arvin, CA, Bakersfield, CA, Buttonwillow, CA, Lamont, CA",
